{
  "사건": {
    "사건명": "해고무효확인 및 연장근로수당·퇴직금 청구의 소",
    "사건번호": null,
    "제출법원": "인천지방법원",
    "수임범위": "소장 작성 및 소송 수행",
    "심급": "1심"
  },
  "당사자": {
    "원고": [
      {
        "성명": "김민재",
        "주민번호": "800101-1******",
        "주소": "서울특별시 강서구 공항대로 000, 000동 0000호",
        "우편번호": "07000",
        "전화": "010-0000-0000",
        "이메일": "mjkim@example.com"
      }
    ],
    "피고": [
      {
        "명칭": "동해물류 주식회사",
        "주소": "인천광역시 서구 봉수대로 000",
        "우편번호": "22600",
        "대표자": "박상호"
      }
    ],
    "소송대리인": {
      "표시": "법무법인 화현 담당변호사 이수진",
      "주소": "서울특별시 서초구 서초대로 000, 0층"
    }
  },
  "사실관계": [
    {
      "일자": "2014.03.03.",
      "사실": "원고 김민재가 동해물류 주식회사에 입사하여 근로관계 개시",
      "근거": "상담메모.md §2"
    },
    {
      "일자": "2023.01.경",
      "사실": "원고가 운영관리팀장으로서 월평균 약 22시간 연장근로 제공 시작. 그 무렵부터 퇴직 전까지 연장근로수당을 전혀 지급받지 못함. 근로계약서에 포괄임금 약정 조항 없음",
      "근거": "상담메모.md §4"
    },
    {
      "일자": "2025.09.경",
      "사실": "회사가 '물류센터 자동화에 따른 조직 개편'을 이유로 원고에게 퇴직 종용 시작",
      "근거": "상담메모.md §3"
    },
    {
      "일자": "2025.09.02.",
      "사실": "원고가 첫 번째 퇴직 권유 면담에서 퇴직 의사 없음을 명시적으로 표시하여 거절",
      "근거": "상담메모.md §3"
    },
    {
      "일자": "2025.10.15.",
      "사실": "원고가 두 번째 퇴직 권유 면담에서 퇴직을 다시 명시적으로 거절. 해당 면담 내용은 녹취됨",
      "근거": "상담메모.md §3"
    },
    {
      "일자": "2025.11.14.",
      "사실": "본부장이 원고에게 구두로 해고를 통보. 서면 해고통지는 일절 이루어지지 않음",
      "근거": "상담메모.md §3"
    },
    {
      "일자": "2025.11.30.",
      "사실": "피고가 원고를 퇴직 처리함",
      "근거": "상담메모.md §3"
    },
    {
      "일자": "2025.12.15.",
      "사실": "원고가 피고에게 해고무효 및 임금 청구 내용의 내용증명 발송",
      "근거": "상담메모.md §3, §5"
    },
    {
      "일자": "2026.01.10.",
      "사실": "피고 회사가 원고의 내용증명에 대한 회신 공문 발송. 퇴직금은 2026. 6.경 지급 유예 합의를 주장하고 있으나, 상담메모 기준 원고는 동의한 사실 없음",
      "근거": "상담메모.md §3; 상대방_답변서.md §3"
    },
    {
      "일자": "2026.06.12.경",
      "사실": "퇴직일(2025. 11. 30.)로부터 14일이 경과한 현재까지 퇴직금이 미지급된 상태",
      "근거": "상담메모.md §4"
    }
  ],
  "쟁점": [
    {
      "id": "쟁점1",
      "제목": "서면통지 흠결에 의한 해고무효",
      "우리주장": "피고는 2025. 11. 14. 구두로 해고를 통보하였을 뿐 근로기준법 제27조가 요구하는 해고사유와 해고시기의 서면통지를 전혀 이행하지 않았으므로, 이 사건 해고는 서면통지 요건을 갖추지 못하여 효력이 없다",
      "상대주장": "피고는 원고가 2025. 10. 15. 면담에서 희망퇴직에 구두 동의하였다고 주장하므로 해고가 아닌 합의 종료를 주장함",
      "법리ref": "리서치/쟁점별_법리.md#쟁점1"
    },
    {
      "id": "쟁점2",
      "제목": "포괄임금 약정 부존재 — 연장근로수당 청구",
      "우리주장": "원고의 근로계약서에 포괄임금 약정 조항이 없고, 11년 이상 이의 없이 급여를 수령한 사실만으로 묵시적 포괄임금 약정이 성립하지 않는다. 피고는 2023. 1.부터 2025. 10.까지 월평균 22시간의 연장근로에 대한 가산수당(통상임금의 50% 이상)을 지급할 의무가 있음",
      "상대주장": "피고는 구두 합의로 묵시적 포괄임금 약정이 성립하였다고 주장함",
      "법리ref": "리서치/쟁점별_법리.md#쟁점2"
    },
    {
      "id": "쟁점3",
      "제목": "퇴직금 미지급",
      "우리주장": "원고는 2014. 3. 3.부터 2025. 11. 30.까지 약 11년 8개월 계속 근로하였으므로 근로자퇴직급여보장법 제9조 제1항에 따라 퇴직일로부터 14일 이내에 퇴직금을 지급받을 권리가 있는데, 현재까지 미지급 상태임. 지급 유예 합의는 원고가 동의한 사실이 없어 효력이 없음",
      "상대주장": "피고는 원고를 포함한 퇴직자들과 퇴직금 지급 시기를 2026. 6.경으로 유예하기로 합의하였다고 주장함",
      "법리ref": "리서치/쟁점별_법리.md#쟁점3"
    }
  ],
  "증거": [
    {
      "표시": "갑1",
      "증거명": "근로계약서",
      "입증취지": "포괄임금 약정 조항 부존재 및 근로관계 성립 확인"
    },
    {
      "표시": "갑2",
      "증거명": "출입기록 및 출고 시스템 로그(2023~2025)",
      "입증취지": "연장근로 사실 및 시간 입증"
    },
    {
      "표시": "갑3",
      "증거명": "면담 녹취록(2025. 10. 15.자)",
      "입증취지": "원고의 퇴직 거부 의사 명시 및 합의에 의한 근로관계 종료 부존재 입증"
    },
    {
      "표시": "갑4",
      "증거명": "내용증명(2025. 12. 15.자)",
      "입증취지": "원고의 해고무효 주장 및 임금 청구 의사 표시"
    },
    {
      "표시": "갑5",
      "증거명": "회사 회신 공문(2026. 1. 10.자)",
      "입증취지": "피고의 주장 내용 확인 및 퇴직금 미지급 사실 확인"
    }
  ],
  "청구": [
    {
      "유형": "확인",
      "청구취지문안": "피고가 2025. 11. 14. 원고에게 한 해고는 무효임을 확인한다",
      "금액": null,
      "산정내역": ""
    },
    {
      "유형": "이행",
      "청구취지문안": "피고는 원고에게 연장근로수당 및 퇴직금 합계 50,480,000원과 이에 대하여 지급 지연일 다음날부터 다 갚는 날까지 연 20%의 비율로 계산한 지연손해금을 지급하라",
      "금액": 50480000,
      "산정내역": "의뢰인 추산 합계액. 연장근로수당: 2023.1.~2025.10. 월평균 22시간, 구체적 통상임금 기준 산정 필요(급여명세 기반). 퇴직금: 11년 8개월 계속근로 기준 산정 필요. 이율은 근로기준법 시행령 제17조 기준 연 20%이나 지연이자의 법적 성질(민사 vs 근로기준법상) 및 적용 여부 변호사 확인 필요"
    }
  ],
  "확인필요": [
    "지연이자 이율 — 근로기준법 시행령 제17조상 연 20%(법적 성격 및 적용 여부 변호사 확인)",
    "연장근로수당 정확한 산정액 — 급여명세서 기반 통상임금 및 월 실제 연장근로시간 확인 필요",
    "퇴직금 정확한 산정액 — 퇴직 전 3개월 평균임금 기준 확인 필요",
    "관할 확인 — 인천지방법원(피고 주소지 기준) 적정 여부 및 사물관할(합의부/단독) 확인",
    "원고 주민번호 뒷자리 마스킹 외 추가 인적사항(주민번호 앞자리 확인)",
    "피고 법인등록번호 및 정확한 주소·우편번호 확인",
    "지급 유예 합의 존재 여부 — 원고 측 확인 필요(상대방 주장과 상이)",
    "해고예고수당(근로기준법 제26조) 청구 여부 — 구두 해고일(2025.11.14.)과 퇴직 처리일(2025.11.30.) 사이 기간 검토 필요"
  ]
}
