{
  "사건": {
    "사건명": "해고무효확인 및 임금 등 청구의 소",
    "사건번호": "2026가합12345",
    "제출법원": "[변호사 확인 필요]",
    "수임범위": "해고무효확인 및 임금(체불 연장수당·미지급 퇴직금) 청구의 소 제기",
    "심급": "1심"
  },
  "당사자": {
    "원고": [
      {
        "성명": "김민재",
        "주민번호": "",
        "주소": "",
        "우편번호": "",
        "전화": "",
        "이메일": ""
      }
    ],
    "피고": [
      {
        "명칭": "동해물류 주식회사",
        "주소": "",
        "우편번호": "",
        "대표자": ""
      }
    ],
    "소송대리인": {
      "표시": "",
      "주소": ""
    }
  },
  "사실관계": [
    {
      "일자": "—(시점 기재 없음)",
      "사실": "피고는 3PL 물류대행업을 영위하는 주식회사로, 상시 근로자 약 120명을 사용함.",
      "근거": "사건기록_임금체불_부당해고.md §1"
    },
    {
      "일자": "2014.03.03.",
      "사실": "원고가 피고 회사에 입사하여 근로계약서를 작성함. 근로계약서에 포괄임금 약정 조항 없음.",
      "근거": "사건기록_임금체불_부당해고.md §3 / 갑1"
    },
    {
      "일자": "2014.03.03.~2025.11.30.",
      "사실": "원고는 피고 회사에서 약 11년 8개월 근속하였고, 최근 3년은 운영관리팀장으로 재직함.",
      "근거": "사건기록_임금체불_부당해고.md §1, §2"
    },
    {
      "일자": "2023.01.~2025.10.",
      "사실": "원고가 주말 출고 피크 대응으로 월평균 22시간의 연장근로를 수행함. 연장근로수당은 지급되지 않음.",
      "근거": "사건기록_임금체불_부당해고.md §2, §3 / 갑2"
    },
    {
      "일자": "2025.09.02.",
      "사실": "피고 인사팀이 원고와 1차 희망퇴직 면담을 실시하였고, 원고는 이를 거절함.",
      "근거": "사건기록_임금체불_부당해고.md §3"
    },
    {
      "일자": "2025.10.15.",
      "사실": "피고 본부장이 2차 면담에서 원고가 '조직 개편 대상'이라고 언급함.",
      "근거": "사건기록_임금체불_부당해고.md §3"
    },
    {
      "일자": "2025.11.14.",
      "사실": "팀장 회의 직후 피고 본부장이 원고에게 구두로 '이번 달까지만 나오라'고 해고를 통보함. 서면 통지는 없었음.",
      "근거": "사건기록_임금체불_부당해고.md §2, §3 / 갑5"
    },
    {
      "일자": "2025.11.30.",
      "사실": "피고가 원고를 퇴직 처리함(4대보험 상실 신고 확인). 해고 30일 전 예고는 없었고 해고예고수당도 지급되지 않음.",
      "근거": "사건기록_임금체불_부당해고.md §2, §3 / 갑3"
    },
    {
      "일자": "2025.12.15.",
      "사실": "원고가 피고에게 퇴직금·체불수당 지급을 요청하는 내용증명을 발송함.",
      "근거": "사건기록_임금체불_부당해고.md §3 / 갑4"
    },
    {
      "일자": "2026.01.10.",
      "사실": "피고가 '경영상 불가피, 정산 중'이라고 회신하였고, 이후 퇴직금·연장수당 미지급 상태가 지속됨(2026.6. 현재).",
      "근거": "사건기록_임금체불_부당해고.md §2, §3 / 갑4"
    },
    {
      "일자": "2026.05.28.",
      "사실": "원고가 소송대리인에게 본 사건을 수임함.",
      "근거": "사건기록_임금체불_부당해고.md §3"
    }
  ],
  "쟁점": [
    {
      "id": "쟁점1",
      "제목": "해고의 존재 및 무효 (서면통지 위반·정당한 이유 부존재)",
      "우리주장": "2025.11.14. 구두 해고 통보는 서면 통지 없이 이루어졌고, 원고는 희망퇴직에 동의한 사실이 없으며, 경영상 해고의 요건도 갖추지 못하였으므로 해고는 무효이다.",
      "상대주장": "피고는 답변서에서 2025. 9.경 조직개편 과정에서 희망퇴직을 제안하였고 원고가 2025. 11.경 이를 수용하여 2025. 11. 30.자로 퇴직하였으므로 해고가 아니라 합의해지라고 주장한다. 또한 설령 해고라 하더라도 물류센터 자동화 설비 도입에 따른 운영관리 인력 잉여가 발생했고 배치전환 등 해고회피노력을 다하였으므로 경영상 이유에 의한 정당한 해고라고 주장한다. (입력/상대방_답변서.md)",
      "법리ref": "리서치/쟁점별_법리.md#쟁점1"
    },
    {
      "id": "쟁점2",
      "제목": "연장근로수당 미지급 (포괄임금 약정 부존재)",
      "우리주장": "원고는 2023.1.~2025.10. 월평균 22시간의 연장근로를 하였고 근로계약서에 포괄임금 약정이 없으므로, 피고는 미지급 연장근로수당을 지급할 의무가 있다.",
      "상대주장": "피고는 답변서에서 원고가 운영관리팀장으로서 근로시간 산정이 어려운 관리감독 업무에 종사하였고, 팀장급에는 포괄임금제가 적용되어 왔으므로 연장근로수당이 이미 기본급에 포함되어 지급되었다고 주장한다. (입력/상대방_답변서.md)",
      "법리ref": "리서치/쟁점별_법리.md#쟁점2"
    },
    {
      "id": "쟁점3",
      "제목": "퇴직금 미지급 (지급유예 합의 부존재)",
      "우리주장": "원고는 2014.3.3.~2025.11.30. 약 11년 8개월 계속근로하였고 퇴직금 지급유예에 합의한 사실이 없으므로, 피고는 퇴직금을 지급할 의무가 있다.",
      "상대주장": "피고는 답변서에서 원고와 피고가 퇴직 무렵 회사 자금 사정을 고려하여 퇴직금 지급 시기를 일정 기간 유예하기로 합의하였고, 피고가 그 합의에 따라 정산을 진행 중이므로 지급의무를 이행하지 않은 것이 아니라고 주장한다. 다만 처분문서·합의서는 현재까지 제출하지 못하고 있다. (입력/상대방_답변서.md)",
      "법리ref": "리서치/쟁점별_법리.md#쟁점3"
    },
    {
      "id": "쟁점4",
      "제목": "해고예고수당 (30일 전 예고 부존재)",
      "우리주장": "피고는 해고 30일 전 예고 없이 원고를 해고하였으므로 해고예고수당을 지급할 의무가 있다. 해고예고수당은 해고의 유효 여부와 관계없이 지급되어야 하므로(대법원 2017다16778) 해고무효확인 청구와 병합 가능.",
      "상대주장": "피고는 답변서에서 청구 전부 기각을 구하고 있으며, 해고예고수당에 관한 독립 항변은 명시하지 않았다. 다만 경영상 이유에 의한 정당한 해고 주장은 해고예고수당 청구에 대한 포괄적 다툼으로 함께 대응한다. (입력/상대방_답변서.md)",
      "법리ref": "리서치/쟁점별_법리.md#쟁점4"
    }
  ],
  "증거": [
    {
      "표시": "갑1",
      "증거명": "근로계약서 (2014.3.3.)",
      "입증취지": "포괄임금 약정 부존재"
    },
    {
      "표시": "갑2",
      "증거명": "출입기록·출고 시스템 로그 발췌 (2023.1.~2025.10.)",
      "입증취지": "연장근로 시간"
    },
    {
      "표시": "갑3",
      "증거명": "4대보험 상실 신고 내역",
      "입증취지": "2025.11.30. 퇴직 처리"
    },
    {
      "표시": "갑4",
      "증거명": "내용증명 (2025.12.15.) 및 회사 회신 (2026.1.10.)",
      "입증취지": "지급 요청·미지급 사실"
    },
    {
      "표시": "갑5",
      "증거명": "본부장 면담 녹취록 (2025.11.14.)",
      "입증취지": "구두 해고 통보"
    }
  ],
  "청구": [
    {
      "유형": "확인",
      "청구취지문안": "피고가 2025. 11. 30. 원고에 대하여 한 해고는 무효임을 확인한다.",
      "금액": null,
      "산정내역": "해고일 특정(2025.11.14. 통보일 vs 2025.11.30. 퇴직처리일)은 변호사 확인 필요"
    },
    {
      "유형": "이행",
      "청구취지문안": "피고는 원고에게 미지급 연장근로수당 [변호사 확인 필요]원 및 이에 대한 지연이자를 지급하라.",
      "금액": null,
      "산정내역": "월평균 22시간 × 통상임금 기준 산정 필요. 통상임금 액수가 입력 자료에 없어 산정 불가 — 확인필요 적재"
    },
    {
      "유형": "이행",
      "청구취지문안": "피고는 원고에게 퇴직금 [변호사 확인 필요]원 및 이에 대한 지연이자를 지급하라.",
      "금액": null,
      "산정내역": "계속근로기간 2014.3.3.~2025.11.30. 평균임금 기준 산정 필요. 평균임금 액수가 입력 자료에 없어 산정 불가 — 확인필요 적재"
    },
    {
      "유형": "이행",
      "청구취지문안": "피고는 원고에게 해고예고수당 [변호사 확인 필요]원 및 이에 대한 지연이자를 지급하라.",
      "금액": null,
      "산정내역": "통상임금 30일분. 해고무효확인 청구와의 병합 형태는 변호사 확인 필요"
    }
  ],
  "확인필요": [
    "원고 인적사항: 주민등록번호, 주소, 우편번호, 전화, 이메일",
    "피고 본점 소재지(주소·우편번호) 및 대표자(대표이사) 성명",
    "소송대리인 표시 및 주소",
    "제출법원(관할) 선택: 후보 ① 피고 본점 소재지 관할 법원(보통재판적) ② 원고 주소지 관할 법원(의무이행지) 산출됨(2026-06-12 /draft-complaint) — 피고 본점·원고 주소 확인 후 법원 특정 및 근로계약서상 관할 합의 조항 유무 확인",
    "원고의 월 통상임금·평균임금 액수 (연장수당·퇴직금·해고예고수당 산정의 기초 — 입력 자료에 없음)",
    "미지급 연장근로수당 청구 금액 및 산정내역 (갑2 로그 기반 정산 필요)",
    "퇴직금 청구 금액 및 산정내역",
    "지연이자 (리서치 '쟁점 공통: 지연이자' 절 반영 — 퇴직 후분 연 20%·기산일 2025-12-15는 소장 초안 반영 완료): ① 해고예고수당에 대한 근로기준법 제37조 적용 여부 및 소장 송달 전 기간 이율, ② 재직 중 기간분 청구 반영 여부·범위(각 월 급여 지급일 미상 — 2025-10-22 이전 도래분 연 5% / 2025-10-23 이후 도래분 연 20%), ③ 상사법정이율 적용 여부",
    "해고일 특정: 2025.11.14.(구두 통보일) vs 2025.11.30.(퇴직 처리일)",
    "퇴직금 청구와 해고무효확인 청구의 관계 (해고무효 시 근로관계 존속 전제와 퇴직금 발생 전제의 정합성 — 청구 병합 구조 결정 필요)",
    "해고기간 중 임금 상당액(복직 시까지) 청구 추가 여부 — 수임범위에 명시되지 않음",
    "노동위원회 부당해고 구제신청 진행 여부 (입력 자료에 언급 없음)",
    "소가·인지액·송달료 (2026-06-12 /draft-complaint 잠정 산출): 잠정 소가 5,000만 원(해고무효확인 비재산권 기준) → 인지액 230,000원(전자소송 207,000원) — 금전청구액 확정 시 다액 기준 재산정 필요 / 송달료(당사자 2인 × 회분 × 단가) 금액 확인 필요",
    "[요건] 임금 ③ 약정 임금액 — 급여명세서·급여계좌 이체 내역 등 임금 액수 입증자료 확보 여부 (임금 청구의 전형적 증거 중 미확보)",
    "[요건] 임금 ③ 지급기일 경과 — 연장근로수당의 지급기일(매월 급여일) 입증 및 지연이자 기산의 기초 (입력 자료에 급여일 기재 없음)",
    "[요건] 해고무효확인 ② 해고의 존재 — 원고의 사직서·희망퇴직 신청서 제출 여부 (입력 자료에 2차 면담 이후 의사표시 기재 없음 — 합의해지 항변 대비)",
    "[요건] 해고무효확인 전형적 증거 — 취업규칙·인사규정(해고 절차 관련) 확보 여부 (미확보)",
    "[요건] 해고예고수당 ④ 통상임금 — 30일분 산정 기초 자료(급여명세서 등) 미확보 (일반 항목 '월 통상임금·평균임금 액수'와 동일 자료)",
    "[요건] 퇴직금 ④ 평균임금 — 퇴직금 산정 기초 자료(급여명세서 등) 미확보 (일반 항목 '월 통상임금·평균임금 액수'와 동일 자료)"
  ]
}
